电影名字,播放数量,弹幕数量,追剧数量,投币数量,点赞数量,标签,分数,打分人数,影片时长(分钟),长评数量,短评数量,简介,Column1
短信杀机,55000,307,935,37,93,剧情惊悚,暂无评分,评分人数不足,83,0,3,简介：聪明勤奋的17岁泰勒的生活，因为接触到社交网络中的真实与谎言而彻底改变了。这个不知名的人物似乎知道很多关于她和她妈妈的事情。泰勒的父亲和汉娜的母亲两年前在偷情时双双死于车祸，本是好姐妹的两人也由此成了冤家。但接二连三收到网络恐吓短信和隐私视频的她们，决定重归于好并联手揪出幕后真凶。并且联合起来，寻找幕后凶手。最后通过监控器泰勒的警察母亲却发现了意外的线索，原来真凶就在他们身边，布兰顿不过是被设计的一枚棋子。泰勒开始自己的调查，她造访科迪，被迫意识到他其实就是在屏幕后面的真相和谎言，并折磨她因为她已故的...,
宝贝训练营,31000,124,724,30,78,剧情爱情,暂无评分,评分人数不足,90,0,1,简介：朱莉亚是一个健身教练，她貌美如花，身材姣好。唯一的遗憾是，30岁了，还没有男朋友。她在公园里开办了宝贝训练营，专门帮助孕妇及新生儿妈妈恢复身材。菲尔和格温是一对夫妻，格温也参加训练营，并且为朱莉亚的另一半操碎了心。单亲爸爸斯科特带着刚生下来的女儿马蒂申请加入宝贝训练营，斯科特还有一个7岁的女儿夏洛特，妻子在怀马蒂的同时，患上了癌症，生下马蒂就去世了。他告诉朱莉亚，自己很想找一个保姆能帮帮自己。格温立马替朱莉亚答应下来，从此朱莉亚就去帮格温照顾两个女儿。,
河口的圣诞节,16000,58,744,34,53,爱情,暂无评分,评分人数不足,84,0,0,简介：平板电脑销售网站设计员凯特与儿子扎克一起生活在繁华大都市纽约，工作的压力让她对儿子疏于照应。直到有一次，在给客户做汇报的会议上，她打开了儿子圣诞视频，看到儿子的圣诞愿望是希望妈妈可以陪他度过美好的圣诞节。凯特突然清醒过来，请了假带儿子回到了路易斯安那州的妈妈家，想要度过一个不一样的南方圣诞。外婆莉莉对于他们的到来非常的开心，扎克也开心极了，每天都可以亲近大自然，无比快乐。一次神奇的经历使得扎克决心留下来并告诉妈妈不想回到纽约去，凯特渐渐爱你意识到这才是自己和孩子想要的生活。,
贝利叶一家,412000,5799,39000,2537,5230,剧情喜剧家庭,9.7,575,105,3,149,简介：农场主贝利叶夫妇和他们的儿子都是听障，日常工作和生活都要依靠女儿宝拉充当手语翻译。宝拉的音乐老师发现了她的天赋，鼓励她去参加法国电台的歌唱比赛。向往着去巴黎继续音乐之路的宝拉将与家人分离。这个人生必经的成年礼，对于贝利叶一家有着更为特殊的意义。,
弗兰克,396000,4563,18000,1411,3840,剧情喜剧,暂无评分,评分人数不足,95,无,无,简介：乔恩（多姆纳尔・格利森 饰）是一个热爱音乐的年轻人，某天误打误撞加入了一支有点神经质的地下乐队，乐队的主唱兼灵魂人物是弗兰克（迈克尔・法斯宾德 饰）――既是才华横溢的天才、又是终日戴着一个硕大头套的怪人。乔恩跟着乐队到爱尔兰某个偏僻的小木屋里录制专辑，他们在此过上几近与世隔绝的生活。这一年来，乔恩一直私自将他们的生活以视频的形式发布在社交网络上。终于，乐队的奇特经历引起了某个音乐节主办方的关注，乔恩说服成员们远赴美国参加这个叫西南偏南的音乐节，藉此成名。,
窃听风云3,3807000,53000,134000,4554,15000,动作悬疑惊悚犯罪,8.1,747,130,3,139,简介：本片讲述香港新界围村陆氏家族在房产开发交易黑幕。村民罗永就（古天乐 饰）醉酒撞死了异姓兄弟陆永远，陆永远之妻月华（周迅 饰）从此与他势不两立。罗永就5年后出狱，发现陆氏家族大家长陆瀚涛和其女陆永瑜，以及女婿已经坐拥新界最大房产公司，而陆家兄弟陆金强（刘青云 饰）等人则疯狂扩张势力。不久香港房产巨鳄邀请罗永就“共商大事”。同时，神秘人阿祖（吴彦祖 饰）透露给月华一个秘密消息，他告诉月华要想在这场欺天阴谋中复仇，就必须按照他的指示去做…,
扫毒,5878000,60000,191000,20000,57000,剧情动作悬疑犯罪,9.3,3937,134,6,809,简介：从小一起长大的好兄弟马昊天、张子伟和 苏建秋共同效力于警队扫毒科。在一次临时改变计划的行动后，建秋因为卧底身份不能与妻子过正常生活而心生退意，但在阿天与子伟的劝说下，三人决定进行最后一搏。建秋跟着毒贩老大黑柴前往泰国与毒贩Bobby进行对接，目的是见到行动的最大目标“八面佛”，阿天则和子伟以及同事阿益进行跟进。由于泰国警方的配合不力导致建秋身份暴露，虽然建秋答应阿天继续把交易完成，但失败的导火索已经埋下…,
玛丽与魔女之花,6093000,32000,266000,15000,24000,动画奇幻,7.7,2727,103,42,1009,简介：改编自玛丽・斯图尔特英国儿童文学小说，玛丽被送到乡下阿姨家过暑假，在一只小黑猫的带领下，她进入森林找到一束紫色魔法花，打扫院落时她用沾有花粉的手碰了扫帚，扫帚突然腾空而起，竟然把她送到森林深处的魔法学校，在这里她学习各种神奇有趣的魔法，但玛丽也发现了这所学校不可告人的秘密。,
饭局也疯狂,2463000,16000,24000,1719,9918,剧情喜剧,5.9,501,85,2,135,简介：高档饭店“天人一”的封老板（刘桦 饰）为如何处理在自己饭店偷录的一张光盘而发愁，但更让他头疼的事情又来了：雇员们因长期拖欠工资全体离职，只有三个本家亲戚留下帮忙，天人一眼看就要倒闭。风水学大师谭大山（范伟 饰）受封老板所托，为他带来一桌饭局，使得某执行总监莫妮卡前来谈判收购事宜时，不至于太过冷清。谭大山带来的客人们：身份神秘的大老总（韩童山 饰）、暴发户矿主蔡哥和偷偷跟随的飞贼小蝴蝶、动作明星家明（黄渤 饰）陆续抵达。刑警老梅一家三口也在这天来天人一就餐。忙乱的饭局上人人各有心思……,
爱与荣耀,1843000,922,11000,331,3966,剧情爱情战争,暂无评分,评分人数不足,93,0,4,简介：利亚姆・海姆斯沃斯扮演奥斯汀的好友兼战友，两人并肩作战、出生入死。奥斯汀在美国本土的女朋友让他情绪失控。于是，两人逃离军队，返回家乡拯救爱情。两人回到反战运动如火如荼的大学校园，奥斯汀将如何挽回他的爱情。,
三笑之才子佳人,1350000,12000,15000,1942,7840,喜剧,7,361,88,0,145,简介：江南四大才子之首唐伯虎（郭德纲 饰）风流多才，无数少女为之倾倒。在唐伯虎演唱会上，华太师府安保部一姐秋香（姚迪 饰）为见偶像混入现场，终与唐伯虎同台献艺，然而天不遂人愿，当夜二人的约会因一场误会而告吹。另一方面，宁王觊觎唐伯虎地产，派出杀手毒砂掌（九孔 饰）将唐伯虎击入河水。华府侍女石榴（郭柯宇 饰）意外将唐伯虎救回华府，后者因受伤失去记忆，从此在华府以华安之名为仆。秋香发现失忆唐伯虎近在眼前，却苦无方法将其唤醒。宁王发出通缉令追索唐伯虎，又派出毒砂掌盗取华太师府中的夜明珠。苏州城内形势对唐伯虎愈发凶险...,
我的战争,987000,13000,11000,1139,4661,剧情历史战争,4.8,560,120,2,149,简介：抗美援朝四大战役时期，中国有这样一支英武勇猛的志愿军，他们为了保卫国家毅然决然远赴他乡，在并肩作战的日子里一起经历生死，建立了深厚的革命情感。孙北川（刘烨 饰）是这支队伍的核心首领，他身经百战、个性粗犷但心地善良，在战场上向来无所畏惧，而遇见文工团队长孟三夏（王珞丹 饰）之后，这份勇猛又多了一层责任感。与此同时，孙北川的好兄弟、司号员张洛东（杨佑宁 饰）也对孟三夏暗生情愫，孑然一身的命运造就了他单纯、乐观的个性，为了撮合北川与三夏，他甘愿隐藏自己的感情......,
江湖论剑实录,4500000,37000,84000,18000,41000,喜剧,9.2,4218,91,12,1503,简介：北宋的普通青年司徒耀祖（郑恺 饰）在名门正派习武学成，进入社会后才发现现实的残酷，他放弃了毫无前途的捕快工作，奔赴首都汴梁寻找人生价值。在汴梁，司徒耀祖结识了无法走红的歌姬王二丫，并与喜好丹青的官二代张鼎鼎（孙坚 饰）不打不相识。因张鼎鼎的父亲不愿儿子成为危险系数过高的驸马，司徒耀祖偶然成为张父的义子，顶替张鼎鼎参与驸马的争夺……,
新步步惊心,997000,7027,6720,302,3278,爱情奇幻小说改,3.2,255,110,2,85,简介：早已成为国际大都会的北京城，生活着古灵精怪的小白领张小文（陈意涵 饰）。她渴望浪漫美好的恋情，无奈命中注定的另一半始终不曾到来。某天，她突遭意外跌入水中。当小文浮出水面，发现自己身着古装，旁边有一个念着奇怪咒语的戴面具的男子，之后更被神秘之人追杀，关键是个则被一名英俊帅气的男子救起。小文原本以为这只是一个离奇的梦，谁知一觉醒来发现自己真的穿越到清朝，成了名叫马尔泰若曦的格格。在此期间，她邂逅了还未成为雍正皇帝的四阿哥胤G（杨v宁 饰）以及日后卷入皇储之争的十四阿哥胤_（窦骁 饰）。浪漫的爱情和皇宫风云，...,
张震讲故事之鬼迷心窍,2274000,10000,12000,554,7602,悬疑惊悚,2.6,621,82,1,198,简介：钟宇（张翰 饰）在戏班里拜杨贺天（张皓然 饰），潜心学习唱念做打。某天，和钟宇相识二十多年的女孩晓来（张俪 饰）来戏班找他，而杨贺天从见面第一眼起就迷上了对方。他尝试着让钟宇把晓来找出来，不过却没有成功。他内心的欲望无法抑制，于是想出了歪门邪道的办法接近女孩。他装鬼吓唬对方，让晓来惊慌失措，从而对及时赶到的杨贺天产生了依赖。谁知这种办法一发不可收拾，晓来和名叫念念（李心艾 饰）的女孩同住，在此之后她们经常被各种可怕的噩梦和幻影幻听所烦扰。晓来内心因沉睡已久的心魔被唤醒，念念的一段黑暗过去也被挖了出来。欲...,
产科医鸿鸟2（H限台车^）,114000,1476,2817,262,2513,都市励志,暂无评分,评分人数不足,, 全11集,0,0,简介：时光荏苒，作为妇产医生已经能够独当一面的鸿鸟樱来到了曾经的恩师荻岛胜秀所在的离岛医院。看着和岛上居民近距离接触的荻岛的身影，樱开始思考一件事情。另一方面，曾经是研修医的下屋和新生儿科的白川都成为了专业医师继续工作着。从离岛归来的樱和助产士小松一起诊察了耳朵听不见的孕妇早见鄄恕Ｋ的丈夫健治也有一同前来，但健治是一位聋哑人。因为医疗术语用手语或者唇语都很难传达，所以改用了白板进行笔谈。另一方面，产科医四宫诊察了想要早日回归职场的职业女性佐野彩加。彩加向四宫询问自己是否可以按照预产期进行生产，但四宫却并...
监狱的公主大人（H限台车^）,43000,949,1565,132,1760,都市刑侦,暂无评分,评分人数不足,, 全10集,1,2,简介：犯下罪行的五位女子，与憎恨犯罪监狱的女教官。原本看似不相容的两方，双方竟开始互通心思，为了替狱中一位背上杀人冤罪的女囚洗清冤屈，而联手策画了一桩向某位男人的复仇计划。然而，执行计划的过程中却状况百出……究竟，在她们几人之中会发生什么样的羁绊和友情？
田姐辣妹,608000,3144,1773,1801,572,情感剧情家庭,暂无评分,评分人数不足,, 全46集,0,4,简介：由于父母早逝，并称渤海三枝花的田佳敏、田佳慧、田佳韵三姐妹从小相依为命，感情深厚。老二佳慧更是一肩挑起了家庭重担，不光包办了大姐的婚姻大事，更为了三妹能在事业上站稳脚跟放弃自己钟爱的话剧舞台。时光飞逝，田氏三姐妹们的女儿们也长大成人到了谈婚论嫁的年龄。佳慧的女儿田梦个性开朗活泼，面对众多追求者，她偏偏选择了胸怀壮志，却身无分文的穷小子甘哲。虽然这一决定遭到众人的反对，但田梦已下定决心要和甘哲一起凭借自己的努力，脚踏实地的去创造属于他们的美好时代。最终，在田佳慧二十多年无音信的昔日好友、如今已是归国华...
大陆的崛起,1372000,3126,10000,559,977,自然历史,暂无评分,评分人数不足,, 全4集,0,6,简介：2.5亿年前，我们今天所知的各大陆连接在一起，被称为盘古大陆，其四面被无边无际的原始海洋所包围着。但大约2亿年前，这片超级大陆开始分裂，出现了新的海洋、盆地和高耸入云的群山。又过了数百万年，剩余的陆地最终分裂为七块新的大陆，每一个都独具特色，这就是我们现在的七大洲。《大陆起源》汇集所有相关资料，利用最先进的电脑影像技术，把从盘古大陆分裂而来的几个大陆重新拼凑在一起，揭秘了每个大陆跌宕起伏的故事，以及每个大陆都如此独特的原因。
天地良心,120000,1285,875,124,281,刑侦,暂无评分,评分人数不足,, 全28集,0,1,简介：停职后的方见涛不甘寂寞，暗中到副市长张清的支持，同时迫使屈辚与之合作，将手中的烂尾楼成功脱手，并获得高速公路项目的开发权，以此套取大量贷款。屈辚升任国税局长，位尊权重，在洋洋得意的同时也在腐败的漩涡中越陷越深。何盈秋眼见屈辚走向毁灭，而自己却无能为力，悲伤中选择了逃避，远走异国。面对方见涛的穷追不舍，吴唤云倍感压力。为了解除威胁，他对方见涛频施暗算，阴谋层出不穷，使方见涛和江盛灵的调查工作屡屡磁带却已被清洗。为了引出幕后黑手，方见涛扣下证据没有上交，顶着挨处分的危险，以索贿的名义与远拓高层联系。由于...
地平线系列：我们为何讲话？,189000,1312,771000,626,1235,科技,暂无评分,评分人数不足,,0,21,简介：本部纪录片是BBC地平线系列推出的一档探秘人类特有能力“说话”的纪录片。说话，这种区别于动物、以此界定为人类的我们所特有的属性，却至今仍是一个谜。当你说话时，轻松自如、毫不费力，以至于你都意识不到它的存在。其实它需要成千上万次的思考和决策，“说话”并非你想象的那么简单。虽然语言学教父诺姆・乔姆斯基指出：我们说话的能力是与生俱来的，但是“语言”或者说“说话的能力”到底来自哪里，它又是如何形成的呢？在本片中，你将看到三组不同的测试和实验：一位父亲用摄像机记录下了儿子头三年里是如何学会说话的，一位会说超过20种...,
高糖VS高脂肪,1071000,5394,771000,3377,13000,科技社会,暂无评分,评分人数不足,,2,18,简介：BBC纪录片《油糖陷阱》本片通过真人测试发现：单独吃糖或脂肪，短期内都可减轻体重；造成肥胖问题的根源是“糖油混合物”；不摄取糖分反而易得糖尿病,
书籍之美,324000,1599,40000,1137,2541,人文历史,暂无评分,评分人数不足,, 全4集,0,3,简介：喜欢圣经？圣经最开始的时候才不是现在的样子呢！那可是经过了多次修改订正之后结果。王权总是和宗教紧密相连，我们一起揭示神圣宗教背后的肮脏交易吧！《坎特伯雷故事集》，怎么样？很熟悉吧！这本书在英国出版业历史上是何等的地位？那可是开山鼻祖呢！它标志着手抄本的最后岁月和印刷图书的新纪元。《爱丽丝梦游仙境》这是最火的古代连环画呢！看过没有？没有？这个片子可是讲这部连环画的呢！还等什么？
私家庄园揭秘,96000,448,11000,446,614,人文历史,暂无评分,评分人数不足,, 全6集,0,5,简介：历史学家丹?克鲁克尚克受邀得以进入六座英国最伟大的私家庄园邸宅，引领我们穿越既令人惊异又颇具启迪性的建筑史。这些迷人的建筑一直为私宅，不对公众开放，但它们的主人们准许丹?克鲁克尚克徜徉其间，趣谈每所宅子的故事― 谁建造的、谁住过、谁又失去了它们，还揭示了关于无度与挥霍、权力与野心的轶事。
吃昆虫能拯救世界吗？,29000,790,1953,128,157,自然动物,暂无评分,评分人数不足,,0,4,简介：吃昆虫能拯救世界吗？吃油炸蝗虫、蚁卵沙拉或者烤狼蛛你会感觉怎么样？在这部纪录片中，你将看到主持人兼美食家的Stefan Gates把自己沉浸在无限制的吃昆虫世界里。他试图克服自己对昆虫挥之不去的厌恶感，探索它们能否真的拯救世界。地球上每个人拥有40吨昆虫，或许昆虫能够真正解决全球粮食危机――每天都有数十亿的人在挨饿。而肉类的巨大需求要消耗全球食物链中大量的粮食。Stefan的任务，在泰国和柬埔寨认识那些以捕获、吃和卖食用昆虫为生的人。从昆虫养殖场的可怕规模，到夜里出去围捕的蚂蚱，再到逮捕咬人凶狠的蚂蚁，这些他都还没准备...,
像乌鸦一样思考,3466000,42000,296000,11000,30000,科技,9.8,361,, 全20集,3,82,简介：片名取自于伊索寓言中的乌鸦巧妙地利用鹅卵石喝到罐子底部的水的故事，本系列旨在教导孩子科学方法的四个步骤：观察、假设、实验和评估。幽默的片段展示了科学方法的前三个步骤，而第四个步骤评估，则留给观众自己思考。例如，两支点燃的长短不一的蜡烛放在一个倒置的花瓶中，哪一支将先熄灭？我们看到了结果，但故事最后仅仅提示了氧气和二氧化碳的相对重量。
冰冻星球,2311000,56000,233000,8005,14000,自然动物,9.8,673,, 全6集,2,143,简介：英国BBC电视台耗时5年制作的纪录片《冰冻地球》于近期推出。这部耗资巨大的纪录片用镜头真实的展现了正在逐渐溶解的地球两极，以及生活在这里的各种生物，片中种种景象让人叹为观止。纪录片的解说员大卫・艾登堡（David Attenborough）爵士称，这可能是人类在地球气 候产生剧烈变化前欣赏到这一景象的最后的机会了。现年85岁的艾登堡爵士说，“这部纪录片捕捉了此前从未记录下来的很多行为和现象。随着时间的流逝，这些影像将会变得越来越珍贵，因为这很可能是我们最后的机会去记录下这些珍贵的场景。虽然在我们到达前的数百年甚至几千年前，地...
守望的天空,3426000,91000,18000,2238,6340,情感,9.8,233,, 全30集,1,86,简介：袁卫国（赵文u 饰）因不堪儿子孤独症折磨，与妻子离婚后又和新欢慧雅（王琳 饰）结合，抛弃了妻子与一双儿女。多年后，母亲病逝，巳成家的葡萄（李沁 饰）承s起照顾哥哥袁望（张欢 饰）和被领养妹妹袁心（王可昕 饰）的重任，为了患孤独症的哥哥，工作弄G了，婆家人又不理解，葡萄只有顽强地坚持着。生活的艰辛磨砺了葡萄的性格，她从绝望中坚定了人生的信念，破茧化蝶般成为一个大爱无疆的女人。后来，袁卫国出现了，可当初负心的父亲已得了尿毒症，生命垂危，葡萄又一次站在了人生的十字路口上。面对曾经自私的父亲，还有趁人之危的小三，...
地平线系列：心智斗争,216000,2087,771000,1399,2653,科技,暂无评分,评分人数不足,,1,17,简介：作为一个物种，我们总认为自己很聪明，是理性动物，能做出理智的决定。但或许我们该重新思考一下。每当我们做决定时，我们的直觉和逻辑就会展开一场斗争，而直觉的力量常常超乎我们想象。这种冲突影响我们生活的方方面面，比如饮食、习惯、信仰等。我们对人类心智的理解将发生变革，丹尼尔?卡恩曼教授将对这场变革进行阐述。,
地平线系列：寻找人工智能,124000,1537,771000,251,334,科技探险,暂无评分,评分人数不足,,0,7,简介：自“图灵测试”诞生后，现代人工智慧似乎已经发展十分成熟，以至于有人宣称数据库+演算法=人工智慧。但真的这么简单吗？马克斯带领我们探究超级计算机华生，亲身参与中文房间实验，去探人工智慧技术的前景。,
BBC地平线: 不受控制？,108000,1588,771000,396,347,科技探险,暂无评分,评分人数不足,,0,2,简介：科学突破意味着，人类更加熟悉大脑的工作原理。《地平线》节目发现，大脑中的潜意识起着惊人的主导作用。对于潜在的危险，人类更多依靠“感觉”，而不是“看”。潜意识的增加和变化意味着，在你重复某项任务时，大脑无需过度劳累。但是人类可以驾驭潜意识吗？潜意识总是正确的吗？人类可否关闭潜意识，甚至是重新打开它？《地平线》节目将为您揭晓。,
节食与长寿,455000,3131,771000,1636,4230,科技人文,暂无评分,评分人数不足,,0,14,简介：《地平线》Horizon由BBC制作，至今已经播出了五十季，一千多集。“地平线节目的目标是提供世界上最伟大的科学家和哲学家一个可以交流他们的好奇、观察和看法的平台，并将他们对世界的新看法引入到我们的日常知识。”本期所讲肥胖是现代人类最大的敌人。那么节食是否会带来健康与长寿，这一直是人们迫切希望得到答案的问题。《BBC地平线：节食与长寿》从几个简单的例子来验证，表达出科学合理的节食对健康有益的观点。,
地平线系列：大数据时代,157000,895,771000,298,623,科技,暂无评分,评分人数不足,,0,3,简介：我们每天制造的数据，比从文明肇始到2000年的总和还要多。推特、搜索引擎、科学实验和股市，这些采用空前复杂算法建立的庞大数据库，为我们带来了宝贵和大开眼界的见解。本片揭示了科学家们如何使用技术和创新来搜寻数据。从使用特殊算法来预测案件发生地的警察部门，能够预知病情的手机应用软件，到坐拥30亿美元避险资金的富豪雇佣宇宙学家、密码破译员和粒子物理学家为他制定决策，地平线节目将为您展示迷人的大数据世界。Horizon meets the people at the forefront of the data revolution, and reveals the possibilities and the promise of ...
史蒂夫・乔布斯：亿万富翁嬉皮士,439000,2469,26000,2477,3963,人文,9.7,211,,0,37,简介：作为一个定义酷消费主义的品牌，苹果已经成为世界上最大的企业之一。苹果的领导人，史蒂夫・乔布斯曾经是一个长发披肩的大学辍学生，有着无尽的野心。他是个能鼓舞人心的完美主义者，并且脾气出名的暴躁。他是一个充满矛盾的男人。他有加利福尼亚的反传统主流文化观点，也是一个炒作艺术大师，给计算机科技带来巨大的进步。局内人，包括和乔布斯共同创立苹果公司的史蒂夫・沃兹尼亚克、史蒂芬・弗莱、万维网的发明者蒂姆・伯纳斯・李和营销大师丽塔・克里夫顿，讲述了苹果在史蒂夫・乔布斯的领导下，崛起、衰落，又再次崛起的故事。苹果颠覆性的产品迎...,
地平线系列：烹饪造就人类吗,44000,594,771000,88,198,人文历史,暂无评分,评分人数不足,,0,1,简介：本部纪录片是BBC地平线系列推出的一档，以探讨烹饪对人类进化演变起到何种影响为命题的纪录片。烹饪对于人类进化的影响之大，可能超乎所有人的想象。作为地球上唯一懂得烹调食物的物种，到底是聪明才智让我们学会此项本领，还是我们仅仅是继承了祖先的成果呢？此刻我们的盘中餐，就是我们和祖先最直接的联系。没有它们，人类就不可能进化为优势物种。本期纪录片就是从奠定人类发展史的肉食开始，追溯到我们的祖先是如何改变他们的饮食结构，并掌握用火烹调食物的。在漫长岁月中的演变和进化，使得解剖学和神经学得到了飞跃性的进步。烹饪，这对...,
安藤忠雄：武士建筑师,222000,3462,31000,2439,3550,人文,9.7,286,,1,62,简介：]料到作品U味十足的知名建B安藤忠雄，七十多q，一_霰慵跳，透露T方式X筋和意志，更和你青春o值尼x：一切都有可能的。]上^大W，沉迷拳簦自W建B，在奈良寺院D悟，他娓娓道恚辉倏创竽思S：建在水上的，建在花池下的，藏身uY的。他⑿》孔幼成大世界，成人c大自然同呼吸的理想度。千f人反Γ每次匾饽睿像武士]刀作稹Ｗ钺淼缴虾＝≡海向y度和效益越挑稹Ｎ涫看虿凰溃因樽右「我只活一次」。,
