电影名字,播放数量,弹幕数量,追剧数量,投币数量,点赞数量,标签,分数,打分人数,影片时长(分钟),长评数量,短评数量,简介,Column1
千禧婴孩档案：2008,52000,597,2175,58,155,人文社会,暂无评分,评分人数不足,, 全3集,0,1,简介：这一特有纪录片系列对25名千禧年出生的儿童的生活进行了追踪，即将进入第8个年头。8岁的儿童面临着许多完全不同的问题。理解他们学习应对家与学校差异并使自己感觉更为安全的方式，在进入到生命中一个按性别区分、男孩女孩都更喜欢各自性别的阶段时，他们的行为会受到怎样的影响？最后，他们如何应付令人提心吊胆的考试？他们最初的态度和结果如何影响他们整个的教育？
南太平洋,1486000,29000,115000,4004,6189,自然动物,9.8,418,, 全6集,0,108,简介：本片为观众揭开南太平洋独有的文化历史，以及海洋中星罗棋布的岛屿的野生生态。摄制队于不同岛屿发现了南太平洋一系列令人赞叹的自然景观，包括难得一见的海底火山爆发、壮丽的宝石珊瑚礁、虎鲨猎获信天翁的一刻以及能撕开椰子的陆上巨蟹……在一些被隔离的孤岛上，更发现了特别进化的食肉毛虫、有耐寒能力的吸血虫、于交配时会发出像牛蛙一样叫声的怪叫鹦鹉及尾巴像猴子尾的小蜥蜴。 南太平洋的土著是地球上最僻远的人类社会，他们会为大家细说祖先们是如何由千里多外迁徙到岛上定居。
马克・扎克伯格：揭秘脸谱网,53000,170,3576,113,309,人文社会,暂无评分,评分人数不足,,0,4,简介：马克・艾略特・扎克伯格（Mark Elliot Zuckerberg），1984年05月14日生于美国纽约州白原市。社交网站Facebook的创始人兼首席执行官，被人们冠以“第二盖茨”的美誉。哈佛大学计算机和心理学专业辍学生。据《福布斯》杂志保守估计，马克・扎克伯格拥有135亿美元身价，是2008年全球最年轻的富豪，也是历来全球最年轻的自行创业亿万富豪。,
零度以下的生活:消融 第一季,603000,12000,16000,606,735,探险人文,暂无评分,评分人数不足,, 全6集,0,24,简介：对四个生活在这片远离人烟的无情领土的不同角落的家庭来说，春天已经回来。严冬过后，在遥远的阿拉斯加，破冰正在进行。《零度以下的生活》的几个坚强的角色面临着全新的挑战。从许多方面来说，春季比冬天难捱多了，是阿拉斯加每年最艰难时候的开始。那些离群索居的人必须最努力地工作，尽可能在寒冬来临前获得更多的食物和关键的资源。极低的温度是冬季最大的敌人，现在，熊和嗜血的蚊子让每个人都高度戒备。积雪覆盖的山成为难以逾越的障碍，湍急的河流、凶猛的掠食动物、夏季的虫子成为生活在这片荒原的男男女女面临的新挑战。
鸟瞰地球,1216000,12000,63000,1120,1845,自然动物,9.8,110,, 全6集,1,31,简介：像鸟儿一样飞翔，并借助人类和鸟类之间的一些特殊关系，《飞越地球》团队拍摄到了最壮观的野生动物画面。这部纪录片拍摄历时4年，覆盖了6个大洲和40多个国家。此外，团队还采用了各种特别的拍摄技术。我们通过鸟类的眼睛观察这个世界。白鹭告诉我们，海豚喜欢在浅滩捕食，上百万只岸禽与海洋中的史前生物共处一地。海鸥把我们带到了莫诺湖，它们张着嘴巴追捕苍蝇。像鸟儿一样飞翔固然快感无限，但是这些壮丽的景观更让人无比感叹。
谋杀倒计时 第二季,407000,1317,13000,297,315,人文社会罪案,暂无评分,评分人数不足,, 全8集,0,4,简介：这个引人关注的创新系列回来了，它讲述了8个令人高度关注并感到震惊的谋杀故事，从凶手和受害者的角度描绘了通向令人恐怖的杀害事件的最后几天。计时从谋杀凶手决定杀人的那一刻开始――这是触发的时刻。每个故事都讲述了受害者生命的最后几个小时以及凶手犯罪前的最后几个小时。本系列从法医学的细节重建杀人事件的细节，利用目击者从未公开讲述过的证词，此外还倾听了受害者家人和朋友的心声。此外，刑事学家、警探、病理学家和跟踪这些案件的媒体记者也对这个系列做出了贡献。
鲁布托鞋的秘密,15000,72,1462,42,72,人文社会,暂无评分,评分人数不足,,0,0,简介：直到最近不久前，鲁布托鞋仍然是时尚界不为人知的秘密之一，它只供时尚界的精英、富有人士和好莱坞的一线演员穿戴，她们愿意为这些红底超高跟鞋一掷千金，鲁布托鞋为何会成为时尚界的标志？,
谋杀倒计时 第一季,137000,3965,13000,516,395,罪案社会,暂无评分,评分人数不足,, 全6集,0,5,简介：这个引人注目的犯罪系列讲述了6个令人高度关注并感到震惊的谋杀故事。每一集都从法医学的角度，描述了案情的惊人细节，从凶手和受害者的角度描绘了通向令人恐怖的杀害事件的最后几天。《谋杀倒计时》从谋杀者和受害者的角度回顾了案发前几天、几小时甚至几分钟的事情，通过戏剧性重建准确找到触发每次谋杀行动的原因。这个系列以独家的目击者证词为特征，这些证词是以前从未公开过的，此外还结合了刑事学家、警探、病理学家和媒体记者的评论。
世界末日,183000,1997,9523,390,1310,科技宇宙,暂无评分,评分人数不足,,0,18,简介：《末日》探索了四个有可能的天启之灾场景，这些都曾被科学家所预言过。影片中使用了惊艳的特效，来生动展现了每个场景可能对文明带来的影响。在这些场景中，有袭击了纽约的大海啸、覆灭了柏林的彗星、祸害了英国的致命病毒；还有在最后，科学家尝试重塑黑洞的过程中，毁灭了整个地球。你想要面临哪一种末日呢？,
罗马隐藏的城市,34000,73,3259,76,178,人文旅行历史科技,暂无评分,评分人数不足,,1,3,简介：古典学者迈克尔?斯科特博士利用罗马街道下方的独特通道和令人震撼的新型可视化技术，带领一个专家小组探访古代世界最令人敬畏的城市、这座城市的创造者以及在这座城市生活的人们。罗马的摩天大楼固然壮观，但它们只是这座城市的一部分。罗马还有一个鲜为人知的地下世界。巨大的地下采石场、地下沟渠和蓄水池，还有竞技场下方精心打造的升降机、活门和机关，影片将首次揭示神奇罗马不为人知的故事。,
食物的未来,23000,310,2046,43,127,美食自然科技,暂无评分,评分人数不足,, 全2集,0,2,简介：我们把食物视为理所当然。超市的货架上摆满了琳琅满目的商品DD四季佳品，来自世界各地。不过从2007年末到2008年，粮食骚乱席卷全球，我们看到了国际食品系统并非看上去那样稳固。这会不会是食物新纪元的开始，旧的认知将从根本上被颠覆？本剧集行遍美洲、拉丁美洲、印度、非洲以及欧洲，向观众展现把食物从田间带上餐桌，并联接世界的这张巨网。找到阻止爆发全球粮食危机的方法。
世界上最著名的学校,1084000,9906,75000,3158,7801,人文社会,9.4,316,,1,90,简介：拥有600年历史的伊顿公学曾经培养了威廉王子、哈里王子和其他许多名人，这所学校现在的情况如何呢？本片记录了三位新生在伊顿公学一个学期的生活。与这里的大多数学生不同，我们的三位主人公毕业于公立初中。因此，这里的许多事情对他们来说是完全陌生的。他们如何适应这里的生活？如何学会人们使用的表达方式？如何应对期末考试的压力？他们能保持住自己的公立学校出身吗？伊顿公学会改变他们看待世界的方式吗？,
盛宴,90000,771,5301,62,224,旅行美食,暂无评分,评分人数不足,, 全3集,0,1,简介：盛宴-节日是指全家、全社区或全国共同庆贺的时间。但是，我们如何通过节日了解一个民族及其文化？美食家兼作家斯蒂芬.盖茨游历日本、印度和墨西哥，探秘这些国家最重要的宗教和文化传统并参加一些有时会持续好几天的非常奢华的活动。当一些家庭或社区聚集起来，吃吃喝喝，唱歌跳舞，并基于自己完全独特的文化传统装扮自己时，他加入他们令人难忘、持续几天的节日活动中去――不论是为期10天的印度阿纳姆节、墨西哥为迎接神灵而举办的“亡灵节”还是仪式中需要使用一个4吨重年糕的日本著名的Matsuri节。
生而为王,1769000,4400,39000,1568,8279,人文历史,暂无评分,评分人数不足,,0,11,简介：随着英国王位新继承人的到来，这部见解深刻的纪录片记录了剑桥公爵和公爵夫人的第一个孩子――伊丽莎白女王二世的长孙、剑桥乔治王子殿下的生活。纪录片着力描述了之前几代王储的童年时光，预测了这个为统治而生的男孩的未来生活。这个节目引人注目，将皇家评论家、历史学家还有皇室亲友都请到节目中，他们最为了解王储将要面临什么样的生活。节目还提供了前几任王储的特别档案资料，其中包括了乔治的父亲威廉王子。本节目突出表现了历代王储生活的变化，阐明皇家成员的诞生既是一个历史事件，并且也是对未来的一种展望。,
人类感官,43000,717,4203,136,257,科技社会,暂无评分,评分人数不足,, 全3集,0,2,简介：这部感性轻松的纪录片带领我们游遍全球，去寻找我们感官的生物根源，揭秘为什么特殊的景象、声音、气味和味道会对我们造成巨大的影响。我们如何对剧烈的疼痛感进行封闭？我们的平衡感如何在极端的条件下工作？通过实景拍摄和电影特效的结合，本片塑造出的惊人影像向我们传递了对感官工作情况的“感觉”。当闹钟响起时，通过放慢上千倍后，我们就可以看见这个“噪音”，看见声音的波纹向我们涌来；我们旋转自己的身体并对进入了黑暗的外耳道的声波进行追踪。
如何建造星球,115000,2229,262000,298,367,科技探险,暂无评分,评分人数不足,, 全2集,0,5,简介：这是终极的工程项目：怎样建造一个星球、太阳系和银河系？要从头开始建设宇宙需要什么？如果你出了错会出现什么情况？和其他任何建设工程一样，这也会出错。把月亮放到错误的位置，或者混合物里的铁有点多……。
生命的故事,987000,34000,117000,3086,4827,自然动物,9.8,255,, 全6集,1,71,简介：从出生的那一刻起，地球上的每种生物就都开始了这场伟大而危险的旅程，这就是生命。和我们一样，动物也必须克服障碍，既要努力成长到成年，又要接受由自然环境、天敌甚至它们自己的家庭所带来的无法预料的挑战。这部引人入胜的纪录片从动物个体的视角来描述，展现了它们从出生到变成父母所经历的过程。
生命,1765000,74000,170000,5258,7458,自然动物,9.8,392,, 全10集,1,105,简介：《生命》是由BBC制作的十集系列纪录片，从2009年10月12日开始在BBC电视台播出。本片制作共耗时四年，全部以高清方式摄制。每集50分钟，外加10分钟的拍摄花絮，总共60分钟。根据《泰晤士报》报道，本系列片耗资一千万英镑，不过BBC官方并未证实这一数字。2009年是达尔文诞辰二百周年，也是《物种起源》发表150周年。为了进行纪念，本片力图展现自然界缤纷物种的多样性，和它们为适应环境而进化出的各种神奇生存本领。
神奇的大脑,45000,94,4326,51,271,历史社会,暂无评分,评分人数不足,, 全2集,0,0,简介：是什么让某人成为天才？天赋的定义是什么？这部独一无二的两小时系列影片探讨了亚洲天才的起源，它似乎与亚洲在全球舞台上的快速发展相吻合。
纹身 日本的图腾艺术,74000,697,4244,274,354,人文,暂无评分,评分人数不足,,0,5,简介：纹身是一种富有层次的表现手法，由不同艺术世家将历久不衰的独特技艺代代相传。我们的旅程将会带领我们去往日本的不同地区，进入纹身大师工作室的秘密后台，见证在人类皮肤上创造出真正艺术画作的精细工程。,
异形昆虫：螳螂,756000,2875,9864,655,2864,自然动物,暂无评分,评分人数不足,,0,16,简介：这是一部一小时的高清纪录片，描述了昆虫世界的主宰；螳螂拥有异星生物的外形，曾给好莱坞科幻电影制作人提供了外星怪物的设计灵感。螳螂不仅拥有非地球的外形，还拥有强大的狩猎能力。这种冷酷猎食者的臂长最长可达20厘米，能够杀死比自身体型大数倍的猎物。,
米饭大师,88000,220,2117,62,158,人文历史,暂无评分,评分人数不足,,0,1,简介：这部电影将带我们开始一段亚洲水稻之旅。在几个亚洲国家中，我们发现了当地与水稻有关的传统：在泰国，人们将新生儿放入米浆中按摩；在日本，人们酿造米酒，生产出备受喜爱的清酒；在印度，人们种植名为“纳瓦拉”的稻谷，作为原产地，这里出产的纳瓦拉大米风味独特，药用价值很高。,
西蒙・里夫的爱尔兰之旅,68000,875,6236,204,420,旅行人文社会,暂无评分,评分人数不足,, 全2集,0,2,简介：探险记者西蒙・里夫开始了他的最新发现之旅。这次，他将前往爱尔兰的魅力岛屿，举世闻名的绿宝石岛，它堪称全世界最美丽的岛屿之一。从海岸线上惊险的悬崖风景到城镇中的当代现实生活，西蒙希望通过这段旅程了解它复杂的过去，并展望未来的日子。这里拥有壮观的景色，也有持续了几个世纪的混乱不堪的历史。西蒙游遍了爱尔兰的山山水水，遇到了形形色色的人物，通过对爱尔兰社会各个方面的观察，他将为我们揭示了这个神秘、传奇和灵动之地，同时也是试图展示身份和实现价值的现代化国家。
自然世界:拯救大熊猫,61000,924,1780,99,173,自然动物,暂无评分,评分人数不足,,0,4,简介：自1961年9月11日世界野生动物基金会作为慈善基金会成立以来，自然保护在这近五十年里取得了极大的进展。大熊猫的故事正好体现了所取得进展的多少。通过获得特别许可进入到位于成都的世界头号大熊猫研究和保护中心进行实地拍摄，这部影片记录了一位大熊猫妈妈及其幼崽的生活，涵盖了大熊猫从出生、人工饲养期到成年早期的各个方面，还讲述了一个国际团队在18个月内细心看护这些大熊猫的点点滴滴。,
天网恢恢：特别篇,36000,56,5824,7,46,社会罪案历史,暂无评分,评分人数不足,,0,1,简介：影片讲述了英国最臭名昭著的连环杀手扼杀者斯托克维尔令人生畏的第一次和最后一次谋杀。肯尼斯・厄尔斯金声称自己在四个月的时间里至少杀死过7位男士和女士，这令所有伦敦南部的老人感到恐惧。厄尔斯金闯入受害者家中，对其进行性侵犯，而后再将其扼杀。影片创新的利用场景还原来剖析连环杀手行凶时的心理。影片试图发现厄尔斯金第一次杀人时的动机以及他最后一次行凶为什么会使他败露从而被捕伏法。,
玩命全接触 第二季,47000,1402,1471,339,163,探险自然动物,暂无评分,评分人数不足,, 全10集,0,0,简介：主持人多米尼克・莫纳汉是魔戒中的梅里和迷失中查理・佩斯的扮演者，从小痴迷野生动物的他与BBC合作拍摄全新旅游历险节目《玩命全接触》。多米尼克将带你跟野生动物和昆虫“交朋友”，去接触最罕见最美丽而又惊奇的生物。
雪宝-一个小企鹅的故事,656000,13000,57000,6246,5811,自然动物,9.8,434,,2,133,简介：BBC1新播出的自然历史电视电影，由凯特温斯莱特(Kate Winslet)献声讲述一只小帝企鹅--雪宝的命运历程。本片拍摄于南极洲的隆冬时节（气温低至-60℃），跟踪记录了这只幼企鹅的冰上岁月，由最初的不安定到后来一步步的成长。,
水下地球,29000,27,2187,42,160,自然科技,暂无评分,评分人数不足,,0,0,简介：灾难即将降临-想象一下，当海平面升高到70米以上时，地球会是怎样的一番景象。著名气候学家们认为，如果二氧化碳排放量一直保持在目前的水平，一场大洪水将不可避免。根据美国国家航空航天局天体生物学家、古生物学家彼得?沃德教授和美国其他权威气候学家的研究，本节目向观众揭示了令人震惊的真相。节目将过去和现在的科学实证、丰富的影像档案、外景拍摄与电脑绘图技术紧密结合在了一起。,
珍宝解密 第一季,265000,2007,49000,524,1110,人文历史神秘,暂无评分,评分人数不足,, 全5集,0,2,简介：《珍宝解密》使用前沿的鉴定技术和实验性考古技术，解开了被隐藏了几个世纪的秘密。它揭开了历史中曾长期笼罩在神秘和争议中的时刻。本系列与考古学家、历史学家、学者和科学家一起拍摄，进行了细致深入的探索，以寻找答案。这个事实与传说互相碰撞的系列探索了每一件珍宝的历史，揭示了曝光它们神奇真相之后可能会产生的影响。
维京解密,95000,683,8946,137,367,人文历史,暂无评分,评分人数不足,, 全2集,0,3,简介：维京人乘坐长船渡过北大西洋，横扫欧洲海岸，证据表面维京人向西的扩张到北美洲，比哥伦布要早500年。考古学家Sarah Parcak利用卫星技术追踪维京人的足迹。
野性巴西,69000,577,3343,144,377,自然动物,暂无评分,评分人数不足,, 全3集,0,2,简介：这里有最壮丽最秀美的风景，这里有数量庞大的野生动物。季节更替，季风带来雨水，也带来勃勃生机。 动物们在这里繁衍、成长，面对洪水、忍受干旱。这里是一片充满活力的大陆，这里是它们的家。 让我们跟着镜头一起，进入这个神奇的国度。领略自然的魅力，感受野性的巴西。
葬礼导演,11000,184,1190,90,61,人文历史社会,暂无评分,评分人数不足,, 全3集,0,4,简介：安排最后的告别.这个精彩的系列带我们以温暖而又敏感的眼光，观察和死亡、葬礼有关的特色和仪式。
亚马逊深渊,279000,1590,7383,484,632,自然探险,暂无评分,评分人数不足,, 全5集,0,7,"简介：如果你认为电视已经覆盖了整个星球的话，那么关上电视，加入到亚马逊雨林中没有电视的冒险生活环境，在遮天闭日的大雨中穿梭。但是这不能阻止Kate Humble和她的朋友。乘坐一条好象密西西比河上的明轮船（浅底、吃水很浅的船）的那种，他们启程去征服亚马逊幽灵般的野外生活。所有其他动物(从名字上)在这里看起来都很“巨大”：黄貂鱼，水獭，海棉，最糟糕的是威力巨大的拈鱼，着名的""jau""，许多生物都是首次上镜。"
与狗同行,180000,189,1765,69,151,动物萌宠,暂无评分,评分人数不足,,0,0,简介：本期《奇妙旅程》深入探究了人类最好朋友――狗的世界，并查明狗为什么能在我们的情感空间中占据如此重要的位置。通过接近在伦敦汉普特斯西斯公园遛狗的人们，饱受赞誉的制片人和导演瓦妮莎?恩格尔探索了为何有如此多的人养狗，以及他们的狗在人类生活中所扮演的角色；展现了既丰富又令人惊讶的故事，描绘出一幅人与狗生活的美妙画卷。,
欢沁之物,32000,92,3095,163,178,人文社会,暂无评分,评分人数不足,, 全8集,0,0,简介：我们将揭开奢侈品的神秘面纱...奢侈品是一切吸引力的源泉，是优质和优雅的结合体。奢侈品制作要求精湛的技艺、全面的知识，并将最简单的原料变成最迷人的艺术品。欢沁之物邀您来到悦目的梦幻奢侈品制作领域。本系列将介绍充满创作激情的大师们如何将各种材料――宝石、木材、皮革、巧克力――变成广受追捧的商品，几大奢侈品家族――爱马仕、法国莱俪、范克里夫――又是如何赢得举世瞩目的。
致命曼谷,600000,2278,5973,300,1133,科技探险自然,暂无评分,评分人数不足,,0,6,简介：曼谷是一个世界大都市。表面上，这些生活在热带曼哈顿的居民生活在阳光之下，但与其他大城市不同，在地下、在黑暗的角落和潮湿的运河里，潜伏着死亡。 数以百万计的蛇和其他有毒生物埋伏着等待猎物，一旦受到打扰便随时进攻。,
爱德华・路贝特和普罗旺斯的味道,21000,26,1753,27,80,旅行美食社会,暂无评分,评分人数不足,,0,1,简介：爱德华・路贝特是法国一位著名的厨师，于2011年由《米其林指南》认证为米其林两星厨师并获得“年度厨师”称号。他的菜肴的食材都可以从大自然中获得。他寻找的特殊原材料创造了一种可口的鸡尾酒风味。,
蚂蚁国 大自然的秘密强邦,2771000,2888,13000,1213,3833,自然动物,暂无评分,评分人数不足,,0,18,简介：它们发动战争但也奉献药物。它们是农户，也是牧民。它们生活中有加密的交流方式、严格的指挥链、神秘的毒药以及惊人的力量。它们已经在我们的星球上生活了数百万年，但似乎是我们最陌生的生物：蚂蚁。这部开创性的纪录片，凭借其引人注目的视觉影像，带你深入蚂蚁神秘迷人的世界。,
品茶大师,110000,691,9525,117,353,旅行美食人文,暂无评分,评分人数不足,,0,1,简介：茶是世界第二大饮品，仅次于水。茶是一种常见的饮品，种茶、采茶和制茶却很讲究，整个过程的完成需要大量的手工劳动力。亚洲本土的茶叶传统源远流长，包括茶叶的特别年份，主产区，百年密码和茶叶知识等等，茶文化内涵丰富，与欧洲的葡萄酒文化类似。,
尖峰火力,515000,3022,14000,529,1687,军事科技,暂无评分,评分人数不足,, 全13集,0,13,简介：战争基地是一档军事科普节目
美食探险家,78000,242,3880,58,136,美食人文,暂无评分,评分人数不足,,0,0,简介：法国的每一个地区都有其独特的视觉和文化特征，但是对于任何美食来说，更为重要的是其风味特征。从海边的布列塔尼半岛，到地中海一带的普罗旺斯，即使是看上去最为简单的菜肴，背后也藏着美味秘密和技术诀窍，这些将由前程似锦的年轻主厨们为你揭晓。 “美食探险家”将为你呈现这些始终在追求正宗美味产品的美食爱好者以及一流的厨师，他们也享受着与鱼贩和农民间的优待关系。,
英国最大的小学,45000,1010,3546,263,309,人文社会,暂无评分,评分人数不足,, 全4集,0,4,简介：这是一部具有透彻观察力的影片，对位于伦敦巴金，拥有超过1100名学生，38个教室，39名老师，以及160多名员工的英国最大小学，加斯科因小学中的两个学期进行了拍摄。这个学校面临的挑战与其他大多数学校一样，但是它却拥有着宏大的规模！本系列讲述的是发生在教室内外的动人故事，充满了戏剧性和情感，并且鼓舞人心。片中的学生、家长和教职员工需要面对这所超级小学中日复一日所发生的混乱和趣事。
战争时期的BBC,36000,130,4259,76,113,人文历史,暂无评分,评分人数不足,, 全2集,0,2,简介：1939年，英国广播公司（BBC)正值毁誉交加之际，必须竭力挽救自己的声誉。随着战争的来临，BBC发现自己陷入了既要与德军纳粹抗争，又要应对英国政府图谋的两难困境。本系列片讲诉了战争冲突如何改变了BBC，BBC的广播在国内和国外造成了什么影响，还揭示了BBC如何在其独立性上与政府进行博弈――脱离了政府为其设定的现代发展之路。 从早期的纳粹宣传诡计迫使BBC不得不采取行动、国内士气危机如何导致广播业的阶级障碍被一扫而空，到顽强的决心和技术的即兴启用如何让广播业从战争区的中心地带迎来发展巅峰。
无法停止,189000,5059,14000,374,2228,人文社会,暂无评分,评分人数不足,, 全4集,0,4,简介：这是一部探秘让人瞠目结舌的强迫症患者的系列剧。片中的人物每天都过着非常奇特的生活，因为他们简直停不下来！每一集中都会聚焦一种不同的强迫症：购物、收集、贮藏和整容，并辅以来自英国和美国的极端案例。在片中，人们被千奇百怪，各不相同的冲动所影响，但是都具有相同的强迫症状。此外，通过近距离的采访，本片还记录了这些人的生活状况和他们的收藏品，充分展示了他们的反常、耸人听闻，有时候甚至是危险的生活方式。
