电影名字,播放数量,弹幕数量,追剧数量,投币数量,点赞数量,标签,分数,打分人数,影片时长(分钟),长评数量,短评数量,简介,Column1
猫女士,329000,3438,16000,1171,4315,动物萌宠,暂无评分,评分人数不足,,0,7,简介：现代人的生活压力越来越大，喜欢养猫和撸猫的人也越来越多。有这么一群单身独居的女性，既是因为孤单，也是因为爱猫，她们选择了与常人截然不同的生活方式―在家里养了大量的猫。她们似乎是被外面的世界放弃，她们同样也放弃了外面的世界，不结婚，不生孩子，只终日和猫咪为伴... 城市里生活着大量的流浪猫，有人以拯救猫咪为己任，救猫的同时尽力为猫咪们寻找新家。但是，随着时间流逝，面临经济问题和邻里问题，她们有些难以维持现阶段的生活方式...,
全新的地球,30000,259,3117,82,400,自然科技,暂无评分,评分人数不足,,1,3,简介：世界正在生病，世界濒临灭亡！地球资源的消耗速度远超再生速度。我们需要重新思考如何减耗、再利用、资源回收，最终重建我们生活耗能的模式。如果我们想要更加可持续性地生活，仅仅提高资源利用率是不够的，是时候团结起来，一起改变我们在地球上的生活方式了，我们现在需要去探索出一种能够满足我们的需求，使我们变得更好的新发展模式，而不必蹂躏孕育我们的星球。,
危险犬只,11000,135,532,55,99,人文社会动物,暂无评分,评分人数不足,,0,0,简介：看到公园里牵着比特犬的人你是否会敬而远之？看到媒体对“恶魔犬”伤人的夸张报道你会不会不寒而栗？看到大型犬只露出獠牙你会不会撒腿就跑？比特犬作为世界十大猛犬之一，究竟该不该被禁养？跟我们一起听听育种人、警察和受害者的观点，看看为什么英国禁犬令的实行对社会安全没有效果。到最后，你会意识到，恶犬之所以恶，根源在于主人。只要有足够的关心和照料，再凶猛的品种，也会是你最好的伙伴。,
达美乐的披萨人生,326000,1556,30000,898,3242,美食社会,暂无评分,评分人数不足,,0,13,简介：一家看似普通的披萨店，居然能够改变一个人的生活？甚至能够成为一个人生活的全部？我说的不是一份工作，不是一种让你赖以谋生的工具，而是督促你洗心革面改邪归正的地方，是你遇到终身伴侣的地方，是让你迅速融入新国家的地方，是为你创造财富，登上人生巅峰的地方，是帮助你实现个人价值，美梦成真的地方！神奇的达美乐，卖的不仅是披萨，更是你美好的未来和瑰丽的美国梦！,
寻找迈克,6563,36,419,25,67,人文社会,暂无评分,评分人数不足,,0,3,简介：迪伦的好友迈克・德布西耶尔离奇死亡，警方经过调查，却发现迈克竟是个顶着别人的身份过活的骗子... 迪伦百感交集，既为好友的欺骗感到愤怒，又始终不愿就此罢手，于是花费12年时间苦心追查好友的真实身份：回到好友曾经的高中寻找，一无所获；来到墓园搜寻，竟发现 “迈克・德布西耶尔”另有其人，是一名去世多年的小男孩；查阅失踪人口档案，竟意外发现迈克的信息... 迪伦到底在一步步接近真相，还是进入另一个更大的谜团中？,
大村官,467000,2171,1479,902,535,搞笑励志,暂无评分,评分人数不足,, 全38集,0,8,简介：大学生村官在农村成长的故事。剧中大学毕业生孙浩然自告奋勇成为一名“大学生村官”，来到偏远落后的山村，在村里朋友田花花的帮助下，在村官这一不起眼的岗位收获成长，带领村民走上发家致富路，自己也由恃才傲物的大学生逐步成为成熟稳重的基层干部。
军事科技秀 第二季,121000,148,5227,223,261,军事科技,暂无评分,评分人数不足,, 全6集,0,4,简介：军事科技秀系列视频将带领观众领略最尖端的军事科技，从科学角度了解军事科技的原理及其在军事领域的应用。涵盖海陆空三军，走在科技前沿，推动世界科技发展，改变军事未来。让我们一起跟随镜头，探寻军事科技的奥秘，纵览世界军事风云。
婆婆媳妇小姑,290000,2598,5562,186,994,搞笑家庭,暂无评分,评分人数不足,, 全23集,0,9,简介：于小娇（傅艺伟 饰）和仇家宝（吕凉 饰）结婚，婆媳关系本就复杂，加之仇家宝此次是第二次婚姻，其家庭关系更是令人头疼。仇家宝的母亲（郑毓芝 饰）自恃甚高，对新媳妇总有诸多看不顺眼的事，明里暗里和于小娇两人较劲。仇家宝还有一个妹妹仇家珠（杨昆 饰）虽已年纪不小但仍旧未婚，常常加入到这场婆媳大战中，使得矛盾激化。这一来，不止于小娇心中叫苦不迭，时间一长，丈夫仇家宝也因为夹板气弄得束手无策。另一头，仇家宝和前妻及其女儿常有来往，在本就不和谐的家庭环境中，于小娇也常常因此忌恨丈夫。婆媳大战谁会是最后的赢家？仇家宝...
道北人,177000,5261,1064,829,272,都市年代,暂无评分,评分人数不足,, 全31集,0,7,简介：该剧通过道北三代人、四个家庭二十年的动荡变迁，着重表现了中国相当数量的城市平民的生活际遇、情感纠葛、命运沉浮和心路历程。
万物与虚无,1153000,6163,140000,5978,12000,人文,9.8,347,, 全2集,0,70,简介：两部纪录片讲述了两个最深刻的问题――什么是万物，什么是无物？在这两部史诗般的超现实主义电影中，吉姆・卡利里教授在探索宇宙真实大小和形状的同时，搜索这些问题的答案，并深入探究虚无背后的科学新知。在此过程中，影片记录了那些发现宇宙真相的科学家们非凡的故事，并探究数学和天文学是如何塑造了我们对太空的理解。
红色利剑,458000,1377,894,673,256,战争,暂无评分,评分人数不足,, 全30集,0,2,简介：一九四零年，一个神秘代号――“佛爷”的出现，军统特务激活了潜伏在延安达三年之久的特务头子“佛爷”，将对边区展开大规模的特务行动，行动目标指向边区第一届参议会，威胁党中央毛主席的安全。智勇双全的鲁平，被誉为“八路军中的福尔摩斯”，凭借着长期地下斗争的经验与智慧，带领侦查科的六名优秀侦查员，克服重重困难，拨开层层迷雾，与“佛爷”领导的汉江班特务组织在延安展开了殊死较量。国民党国防部高级军官代表团的机要参谋神秘失踪、延安郊外东高村出现的白发魔鬼。使得鲁平从上任开始就陷入了毫无头绪的迷案之中。鲁平带领着侦察...
作弊的真相,23000,141,1887,76,167,人文社会,暂无评分,评分人数不足,,0,1,简介：这是家长们梦寐以求的一刻，那些年辅导的家庭作业，所有花在学费和书本的钱，都将得到回报了。但是，直到你看到孩子们为达到目的玩的一些小把戏。想怎么作弊就怎么作弊，它能让你成为一个更厉害的人。专家们也说，想要我们的孩子们不作弊，除非我们开始设立一个更好的榜样。那就意味着，首先要解决一些其他的事，要缩小经济上的不平等，提高人民的安全感，这样都对减少作弊的观念很有帮助。,
沉默与谎言,89000,1058,695,523,407,都市年代刑侦,暂无评分,评分人数不足,, 全30集,0,2,简介：故事中塑造了很多让人同情和惋惜的女性，讲述了三个女人的恩怨情仇和人生命运，交织成一幕幕悲喜剧，成为社会转型时期的生动写照。这部不仅是一部反腐败的电视剧，更是一部讲述了现代中国社会中不同女性的血泪史。
二叔,2127000,24000,4342,637,2459,农村,暂无评分,评分人数不足,, 全38集,0,35,简介：该剧纪录了一个男孩到男人的成长过程，讲述了二叔尔志强从一个桀骜不驯、毫无责任感的少年，成长为对家庭、对自己都问心无愧的顶天立地的男人的人性史诗。二叔的“二”，让他付出了沉重的代价，大哥由他的过失而死，他因报仇打伤人而身陷囹圄，女朋友离他而去，大嫂一家的孩子们对他颇有成见。二叔就是在这样的逆境中，用自己独有的魅力，由一个爱闯祸的小伙子，成长为一个敢担当的男人。
欢迎来到减肥世界,2659000,4971,60000,2293,14000,社会,暂无评分,评分人数不足,,0,8,简介：本片会深入由三家不同公司（慧俪轻体，纤体世界和迷迭香康利）经营的，在三个不同伦敦郊区的，三家不同的节食俱乐部。万特蓝德（Wonderland）会跟随三名节食者的经历。本片会深入研究节食者的心理，以探寻他们减肥的动机。在他们试着遵循他们所签约的详细减肥规则和指定饮食计划时，本片也会进行追随拍摄。在过程中，关于人们怎样过他们的生活和人们对自己的感觉如何，本片会揭示一些深刻事实。本片也会探索，我们对于我们体重的感受，是怎样和我们的自信感和健康感错综复杂地结合在一起的。,
为什么数学说不通,286000,1180,771000,589,2016,人文,暂无评分,评分人数不足,,0,14,简介：数学存在于我们生活的方方面面。但数学也是让很多人头疼的一个问题。艾伦?戴维斯就是其中之一。作为著名喜剧演员，艾伦在周末喜欢看足球和泡酒吧。对他来说，数学可怕、枯燥，并且只适合没有什么社交技巧的人。对牛津数学教授马库斯?杜?索托依来说，数学却是最让人兴奋，最富有创造性的题目。他非常想和大众分享自己对数学的热爱。在两个星期的时间里，马库斯是否能让艾伦像一个数学家那样思考？,
橙色阻击,94000,167,384,176,146,都市年代刑侦,暂无评分,评分人数不足,, 全27集,0,0,简介：西西里岛突然发生了几起黑帮团伙性火拼，一国际贩毒集团抢走了刚研制的第三代毒品的配方及成品。公安部获悉一代码为”三D“的神秘女子携带毒品的配方及样品秘密的潜入了中国的沿海城市--海阳市，认为该市定有其组织在我国大陆设立的毒品生产基地，公安部命令海阳市公安局务必严查！！
行走的红地毯 圣诞岛红蟹,432000,1035,2998,288,678,自然动物,暂无评分,评分人数不足,,0,6,简介：澳大利亚的圣诞岛是印度洋开阔海域上一个孤立的热带岛屿。在这个被热带雨林覆盖的岛屿上，红蟹大量繁殖。雨季开始时，五千万只红蟹从森林前往海滩。这支庞大的队伍就像一张穿过岛屿的红地毯。 这种大规模迁移的目的是繁殖。 经过漫长艰辛的旅程之后，海滩上覆盖着肉眼可见的蟹卵。与此同时，在海洋里，世界上最大的鱼――鲸鲨，静静地潜伏着，等待新孵出的红蟹，以享受一场饕餮盛宴。,
步步紧逼,215000,1029,1274,218,959,剧情,暂无评分,评分人数不足,, 全21集,0,0,简介：新安市一标志性的建筑新安商城迎来隆重的开业庆典，省市领导前来剪彩。商贩陈宝林发现商城裙楼有裂缝，商城经理杨涛叱其危言耸听。陈宝林遭到杨涛手下大头毒打，刑警队长钟砾岩率众成功解救了陈宝林夫妇。商城大楼岌岌可危，剪彩的时刻业已临近，市长王安合决定，剪彩仪式照常进行。暴风雨中，商城裙楼轰然倒塌，一具腐烂的女尸显露了出来，众人极为震惊。倒塌的商城造成严重的人员伤亡，受害群众及家属悲痛欲绝，群情激愤。市委书记范文先、市长王安合决心严查此案、严惩凶手。案情严重，专案组成立，钟砾岩、高彪、小姚对案子展开调查……
筑地 深入世界上最大的鱼市场,229000,731,5145,229,480,美食社会,暂无评分,评分人数不足,,0,2,简介：筑地市场是世界上最大的鱼市场。每天有1700吨鱼被出售给了超过3万个来自世界各地只为买到最好的鱼的职业买家。即使是电脑也无法应对最抢手的金枪鱼被拍卖出的惊人速度。这里充分地展现了复杂的人际关系与各色谈判，但是，买卖双方之间的深厚信任也为彼此建立起了出人意料的和睦氛围。该市场由经验丰富的专业人员在网络上运行，其复杂度如同人类的大脑神经系统。让我们一起前往幕后，欣赏这个神奇的筑地市场。,
海洋之死,40000,242,771000,114,242,自然动物,暂无评分,评分人数不足,,0,2,简介：真相、幻觉和感官。戴维?爱丁保罗夫说，我们的行为正在将世界上的海洋推向毁灭的边缘。国际海洋生物普查计划是迄今为止最广泛的世界海洋资源盘点项目，该项目调集了来自90个国家的2000名科学家。它将改变我们对世界海洋的看法，让我们更好了解海洋生物的现状，我们对海洋的影响，以及未来将会怎样。本期《地平线》将会为您揭示科学技术、带您会见科学家，并探索这一庞大计划的某些发现。,
地平线系列：人口极限,39000,714,771000,77,195,人文科技社会,暂无评分,评分人数不足,,0,4,简介：欢迎来到我们的拥挤世界世界人口在不断增长，在接下来的四十年里，可能会超过九十亿。在这个精彩的节目中，著名自然学家和主持人大卫?艾登堡爵士将研究我们作为一个连续发展物种所面临的这个问题。从墨西哥到西班牙，中国到卢旺达，他采访了生态学家、人口统计学家、农民、工程师和从事计划生育的医生。他们为我们讲述应对人口增长要面临的巨大挑战。世界上每天有四十万人出生，大卫?艾登堡对此问道：地球上最多能生活多少人？人口控制是否应该成为我们每个人的义务？,
地平线：寻找自我意识,64000,948,771000,286,447,人文科技,暂无评分,评分人数不足,,0,6,简介：数千年以来，哲学家一直在努力尝试解答这两个问题：我是谁？自我意识如何通过大脑产生？然而一直未得出满意的答案。然而最近神经系统学家得到了一些令人兴奋又紧张的发现。在这期发人深省的节目中，牛津大学数学教授马库斯.杜.桑托伊在他自己的大脑中进行了一次深度旅行――进行了一系列神经系统中十分不寻常的实验，来探索“自由意志”和“自我”的真正由来。HOR发现，其实，你并非是你想象中的模样。,
铁血刀锋,1135000,1456,1763,247,882,战争,暂无评分,评分人数不足,, 全27集,0,2,简介：1936年3月的上海，国民党军特种营营长汤敬武在日租界处决了作恶的日本浪人日军士兵，其正义之举遭到严厉处置。他率部杀出重围，以第一次“破腹”行动绝处逢生。日军多次收买无果决定将其剿灭。汤团突破重围投奔新四军，第二次“破腹”成功。中共苏中军区司令员束宇交给汤团一项“假投敌”的特殊任务，以粉碎日军大扫荡阴谋，于是，汤团踏上了第三次“破腹”的征途。汤团几乎以假乱真的“投敌”诚意终于得日军高层的认可，一千人马名正言顺地插到了敌人的心脏里。潜伏87天后，汤团终于打响了第三次“破腹”行动的战斗。战斗胜利了，遗撼的是汤敬...
地平线: 马航370，你在哪？,126000,1194,771000,247,712,人文科技灾难,暂无评分,评分人数不足,,1,8,简介：本片是BBC制作的Horizon(地平线)系列纪录片之一，《地平线》是英国广播公司(BBC)最经典的科教系列之一。本片以实地采访、专家分析、模拟再现等方式还原了马来西亚航空370号班机失踪的全过程，以及海事卫星科技手段在搜寻过程中起到的巨大作用；是迄今为止最好的马航370事件纪录片之一。,
石光荣的战火青春,245000,706,1010,655,759,战争情感,暂无评分,评分人数不足,, 全31集,0,1,简介：1942年，得知自己的父母和童养媳桔梗被投奔日军的汉奸刘老炮抓走，身为独立团连长的石光荣俘虏了刘老炮。国民党24团的沈团长曾被刘老炮救过，他以国共合作为由出面调解，让刘老炮放了桔梗等人，也将刘老炮偷偷放跑。这让石光荣不再相信沈团长。桔梗参军当护士陪在石光荣身边。但石光荣只把桔梗当妹妹，他喜欢上卫生队的护士王百灵。刘老炮将石光荣的父母烧死，愤怒的石光荣和桔梗发誓要抓住刘老炮。日本宣布投降，刘老炮投奔到国军沈团长部下。内战爆发，石光荣升为师长，和沈师长为接收东北展开激战。沈师长率残部逃上山和刘老炮当了土匪。淮...
爱在战火纷飞时,81000,567,383,369,424,年代,暂无评分,评分人数不足,, 全28集,0,1,简介：一部表现家族恩怨和时代命运的革命历史剧。主人公张世杰出身当地名门望族，后来加入地下党，在敌占区与国民党、土匪和日军巧妙周旋，直至革命胜利。这部作品在揭密一段传奇的基础上，将宅门恩怨、情感纠葛揉纳其中，是对以往革命历史题材作品的一次“颠覆”。擅演坏蛋的香港无线小生温兆伦，首次挑战红色经典，扮演这位七情六欲、却又另类真实的抗战英雄。除了温兆伦在扮演男主角张世杰之外，宋春丽、王洛勇、师小红、卢奇和祝新运等一大批实力派演员也在剧中各司其角。
见证灵光一闪的时刻,24000,90,771000,42,97,人文科技社会,暂无评分,评分人数不足,,0,0,简介：创造力将人类区分开来。它支撑着我们最喜欢的技术，是我们的音乐和艺术之源，并使我们能到太空遨游。长久以来，创造力被视为上天赐予的礼物，是科学无法解释的东西……直到现在也是如此。本片将寻找在你有一个杰出创意前、你的大脑里都发生了些什么，探索白日梦如何能帮助你成为有创造力的天才以及迷惑与杰出创意之间的联系。,
奸细,143000,119,645,429,263,战争,暂无评分,评分人数不足,, 全40集,0,1,简介：绵延八年之久的抗日战争终于结束，而国共两党则旋即拉开了争霸天下的大幕。在这个重要的历史时刻，晋冀鲁豫边区某军分区参谋长罗天刚（佟瑞欣 饰）、团长邓彪（赵恒煊 饰）、作战处长楼剑飞（海顿 饰）三人同日迎来了洞房花烛夜的大喜时刻，林薇（赵小熠 饰）、韩晓鸥（杨梓艺 饰）、李檬（李思思 饰）三位各有千秋的美丽新娘，成为当天最大的亮点。谁知就在婚礼进行到最高潮时，一条消息传来令所有的人都呆若木鸡，原来三个新娘中混入了国民党派来的奸细“含羞草”。家国大义面前，儿女情长不得不抛却一边。三位新郎在隐藏消息的同时，不得不...
地平线系列：我们该玩电子游戏吗,170000,2010,771000,434,496,科技社会,暂无评分,评分人数不足,,2,12,简介：《地平线》将研究一代人的大脑和行为是否正受到视频游戏的影响。观众将通过影片了解，开发人员如何设计游戏，确保游戏在玩家的挫败感和厌倦感之间找到最佳落点。同时，《地平线》将介绍全球各地正在进行的部分科学试验，揭示玩游戏对行为、生理及神经系统产生的影响。如果玩家喜欢最暴力的游戏，那么他们的行为是否更暴力？游戏玩家是不是在空间导航方面表现得更好？电子游戏到底有多容易上瘾？,
BBC 地平线系列：陷穴吞没记,42000,177,771000,69,88,灾难科技自然历史,暂无评分,评分人数不足,,0,0,简介：2013年2月28日，佛罗里达坦帕市东郊住宅区，正在熟睡中的杰夫?布什和他的卧室突然消失得无影无踪。可怕的是，他消失前毫无征兆，杰夫从此杳无音信。他被陷穴吞没了。那么，陷穴是如何形成的？对于陷穴我们能做些什么？在这个不可思议的地理侦探故事片中，伊恩?斯图尔特博士发掘了地球几百万年的历史，以寻找这些问题的答案，并追问是否会有更多陷穴在我们身边出现。,
射天狼,388000,964,748,596,329,战争,暂无评分,评分人数不足,, 全40集,0,0,简介：《射天狼》主要讲述了辛亥革命到抗日战 争爆发前，发生在大西北的一段传奇故事 。该剧重要情节是围绕着日本人在敦煌莫 高窟全力寻找古老奇书《西域水考》展开 的，这部手稿主要记录了这条丝路上的水 源，只有了解沿途的水源所在，才能通过 这条丝路。而日本人寻找手稿的目的，也 正是为了把这条丝路牢牢控制在手里……
宇宙的黎明：真正的创世时刻,136000,1374,262000,481,464,科技自然,暂无评分,评分人数不足,,0,15,简介：忘掉大爆炸吧！所有关于宇宙诞生的赞誉都给了它，而实际上大爆炸的即刻结果是一片漆黑和虚无。那时的宇宙没有恒星，没有星系，只有一团气体；这是宇宙历史上的黑暗时代。然而，在这样的状态持续了一亿年之后，一个真正的剧变时刻来临了。这是第一批恒星形成的时刻，宇宙第一次被点亮的时刻，宇宙的最初结构和生命的第一批原料诞生的时刻。寰宇初曦，创世纪的真正时刻。,
白银谷,708000,16000,3484,860,1170,古装,暂无评分,评分人数不足,, 全45集,1,7,简介：故事发生在清朝光绪年间，因为惹上洋人的人命官司，大清国驻法公使杜长萱及女儿杜筠清被迫逃到位于山西太谷的故乡暂避风头。落难期间，杜家父女得到晋商康家的康三爷救助，筠清也对这位谈吐不俗的恩人产生好感。可是父女俩可以说才脱狼穴，又入虎口。康家和秦家两大晋商家族相互仇视，倾轧不止，为了挫败对方两家可谓是明枪暗箭，奇谋迭出。而拥有官场背景的杜长萱，无疑成为康秦两家急于拉拢的对象。最终杜筠清被逼无奈，嫁给了康三爷的父亲，而自幼接受西方先进教育的筠清，与这个封建礼教大家庭格格不入，内外纷争自然接踵而至。此时人们还...
我们真的了解宇宙吗？,161000,1647,262000,427,584,科技宇宙,暂无评分,评分人数不足,,0,4,简介：仰望星空，多么美好的一个词。140亿年前，天地混沌。大爆炸产生万物，我们的宇宙诞生了。科学界就是这么解释，宇宙诞生那一刻的。然而新一代的宇宙学家们开始质疑，关于宇宙的起源，关于我们对宇宙的一些基本了解，是不是真的正确。本片从宇宙学标准模型讲起，从暴胀理论，到暗物质及寻找暗物质的研究，到暗能量，及暗流的理论。最后会得出怎样的结论呢？,
我们为何为人,52000,671,771000,177,234,科技,暂无评分,评分人数不足,,0,3,简介：爱丽斯・罗伯茨教授身怀着她的第二个孩子，她想在他出生之前探索“人之为人”这个问题。人类基因中有99%的部分是与黑猩猩相同的；然而从出生的那一刻起，人类的生活就完全不一样。所以，人类是否仅仅是一个普通的物种，抑或人类有特殊之处？爱丽斯教授探索了我们的身体结构、我们的基因、以及最终我们的大脑，试图发现什么终究造就了人类。,
烧饼皇后,358000,9469,6382,1483,1948,古装,暂无评分,评分人数不足,, 全19集,0,14,简介：朱秀容（关咏荷 饰）经营着一间烧饼铺，生意极好，誉满京城。尽管朱秀容容貌端庄秀丽个性又热情开朗，但家中有一十分难缠的瞎母（吴云芳 饰），因此屡屡吓跑想要山门提亲之人，于是，年近三十的朱秀容至今依旧孤身一人，待嫁闺中。萧璃（关咏荷 饰）贵为皇后是高高在上的一国之母，然而却三年为见夫君，只因为皇帝沉迷于木工活中无心管理朝政，更无心顾及妻子。这两位个性和身份的迥然不同的女子，却因为极为相似的容貌而被命运联系到了一起，大大咧咧的朱秀容误打误撞进了宫，而温婉可人的萧璃则遭到了丞相之妹梁凤（刘洁 饰）的追杀，躲进了...
猫的秘密生活,700000,5837,771000,1508,2592,动物萌宠,暂无评分,评分人数不足,,0,16,简介：《地平线》栏目帮你发现宠物猫在猫门以外的生活。 这是一个开创性的实验，研究人员给在萨里郡的一个村庄50只猫戴上了标签与GPS项圈，并记录他们的白天黑夜在后院、花园围栏和灌木狩猎和巡逻的行踪。 此片开发了猫对这个世界的独特视野。你以为你足够了解自己的宠物猫？其实他们的秘密生活会让你惊讶。,
